,Headline,Date,URL,Company
0,"Qorvo Inc. stock rises Thursday, outperforms market",2023-04-20 17:20:00,https://www.marketwatch.com/data-news/qorvo-inc-stock-rises-thursday-outperforms-market-c4ab7173-e094d41f3599?mod=mw_quote_news,qrvo
1,"Qorvo Inc. stock falls Wednesday, underperforms market",2023-04-19 17:20:00,https://www.marketwatch.com/data-news/qorvo-inc-stock-falls-wednesday-underperforms-market-965a9a14-e8937c29eaa0?mod=mw_quote_news,qrvo
2,"Qorvo Inc. stock falls Tuesday, underperforms market",2023-04-18 17:19:00,https://www.marketwatch.com/data-news/qorvo-inc-stock-falls-tuesday-underperforms-market-e15daa82-120534d344a0?mod=mw_quote_news,qrvo
3,"Qorvo Inc. stock rises Monday, still underperforms market",2023-04-17 17:19:00,https://www.marketwatch.com/data-news/qorvo-inc-stock-rises-monday-still-underperforms-market-71e2b713-8152b99dadf6?mod=mw_quote_news,qrvo
4,Qorvo Inc. stock outperforms market despite losses on the day,2023-04-14 17:19:00,https://www.marketwatch.com/data-news/qorvo-inc-stock-outperforms-market-despite-losses-on-the-day-e8ebe6a9-ce1deace5769?mod=mw_quote_news,qrvo
5,"Nvidia, AMD, and 3 More Chip Stocks to Buy for a Turnaround, According to an Analyst",2023-03-02 14:34:00,https://www.marketwatch.com/articles/nvidia-amd-intel-chip-stock-price-fb44087f?mod=mw_quote_news,qrvo
6,BioSig Names Buhaly as Finance Chief as Chaussy to Retire >BSGM,2023-02-07 08:26:00,https://www.marketwatch.com/story/biosig-names-buhaly-as-finance-chief-as-chaussy-to-retire-bsgm-271675776388?mod=mw_quote_news,qrvo
7,Qorvo stock drops nearly 10% as analysts expect inventory correction to continue,2023-02-02 12:36:00,https://www.marketwatch.com/story/qorvo-stock-drops-nearly-10-as-analysts-expect-inventory-correction-to-continue-11675359377?mod=mw_quote_news,qrvo
8,Qorvo stock falls as outlook disappoints,2023-02-01 16:22:00,https://www.marketwatch.com/story/qorvo-stock-falls-as-outlook-disappoints-01675286580?mod=mw_quote_news,qrvo
9,Qualcomm stock declines after Wells Fargo turns bearish,2022-12-12 09:18:00,https://www.marketwatch.com/story/qualcomm-stock-declines-after-wells-fargo-turns-bearish-2022-12-12?mod=mw_quote_news,qrvo
10,Chip stocks and Apple supplier shares fall after report of disappointing iPhone demand,,https://www.marketwatch.com/story/chip-stocks-and-apple-supplier-shares-fall-after-report-of-disappointing-iphone-demand-2022-09-28?mod=mw_quote_news,qrvo
11,3 Chip Stocks That Could Be Takeover Targets: Analyst,,https://www.marketwatch.com/articles/chip-stocks-takeover-targets-51663271903?mod=mw_quote_news,qrvo
12,Don’t Give Up on the Chip Makers. These 9 Stocks Look Like Bargains.,2022-08-12 15:40:00,https://www.marketwatch.com/articles/intel-chip-stocks-to-buy-now-51660333062?mod=mw_quote_news,qrvo
13,Qorvo Stock Has Crumbled but Analysts Say the Chip Maker Is Still No Bargain,2022-08-04 12:36:00,https://www.marketwatch.com/articles/qorvo-stock-outlook-wireless-chips-51659630894?mod=mw_quote_news,qrvo
14,Qorvo stock rallies on earnings beat,2022-08-03 16:22:00,https://www.marketwatch.com/story/qorvo-stock-rallies-on-earnings-beat-2022-08-03?mod=mw_quote_news,qrvo
