,Headline,Date,URL,Company
0,"FMC Corp. stock falls Thursday, still outperforms market",2023-04-20 16:55:00,https://www.marketwatch.com/data-news/fmc-corp-stock-falls-thursday-still-outperforms-market-b00a10fa-8b1bb2d33ebc?mod=mw_quote_news,fmc
1,"FMC Corp. stock falls Wednesday, underperforms market",2023-04-19 16:55:00,https://www.marketwatch.com/data-news/fmc-corp-stock-falls-wednesday-underperforms-market-e2fbfb9d-7393cf24a81e?mod=mw_quote_news,fmc
2,FMC Corp. stock outperforms market on strong trading day,2023-04-18 16:55:00,https://www.marketwatch.com/data-news/fmc-corp-stock-outperforms-market-on-strong-trading-day-95fccb0b-5ce3397a1bba?mod=mw_quote_news,fmc
3,FMC Corp. stock outperforms competitors on strong trading day,2023-04-17 16:55:00,https://www.marketwatch.com/data-news/fmc-corp-stock-outperforms-competitors-on-strong-trading-day-543d69a-4d88eff20f3b?mod=mw_quote_news,fmc
4,FMC Corp. stock outperforms competitors despite losses on the day,2023-04-14 16:55:00,https://www.marketwatch.com/data-news/fmc-corp-stock-outperforms-competitors-despite-losses-on-the-day-9c4a8720-b810209476ab?mod=mw_quote_news,fmc
5,3 Big Themes for ESG Investing and How to Play Them,2023-01-10 01:00:00,https://www.marketwatch.com/articles/esg-investing-themes-2023-51673048125?mod=mw_quote_news,fmc
6,Tesla and EV Demand Is Rising. An Analyst Upgrades  Lithium Stock Albemarle.,2022-07-20 09:08:00,https://www.marketwatch.com/articles/tesla-ev-demand-lithium-stock-fmc-51658322439?mod=mw_quote_news,fmc
7,FMC’s Latest Deal Is All About Being Nicer to Mother Earth,2022-06-29 16:46:00,https://www.marketwatch.com/articles/fmc-merger-sustainability-biophero-51656535554?mod=mw_quote_news,fmc
8,Barron’s Pick: This Underperforming Commodity Stock Looks Ready to Rally,2022-03-10 02:30:00,https://www.marketwatch.com/articles/buy-fmc-stock-pick-51646873933?mod=mw_quote_news,fmc
9,AGCO Earnings Boost Deere and the Entire Farming Sector,2022-02-08 10:37:00,https://www.marketwatch.com/articles/agco-earnings-boost-deere-and-the-entire-farming-sector-51644334671?mod=mw_quote_news,fmc
10,6 Agricultural Stocks Poised to Ride Food Prices Higher,2021-05-07 20:44:00,https://www.marketwatch.com/articles/6-agricultural-stocks-poised-to-ride-food-prices-higher-51620434692?mod=mw_quote_news,fmc
11,FMC's sales slip on supply-chain disruptions,2021-02-09 17:54:00,https://www.marketwatch.com/story/fmcs-sales-slip-on-supply-chain-disruptions-2021-02-09?mod=mw_quote_news,fmc
12,"Albemarle Stock Is Up. That’s Good For These 5 Other Stocks, Too.",2019-02-21 12:08:00,https://www.marketwatch.com/articles/albemarle-stock-is-up-thats-good-for-5-other-stocks-too-51550768882?mod=mw_quote_news,fmc
