,Headline,Date,URL,Company
0,"Motorola Solutions Inc. stock falls Wednesday, underperforms market",2023-04-19 17:11:00,https://www.marketwatch.com/data-news/motorola-solutions-inc-stock-falls-wednesday-underperforms-market-c3068d81-2650817b517c?mod=mw_quote_news,msi
1,"Motorola Solutions Inc. stock falls Tuesday, underperforms market",2023-04-18 17:11:00,https://www.marketwatch.com/data-news/motorola-solutions-inc-stock-falls-tuesday-underperforms-market-b401bd17-97121fbe8ca3?mod=mw_quote_news,msi
2,"Motorola Solutions Inc. stock falls Monday, underperforms market",2023-04-17 17:11:00,https://www.marketwatch.com/data-news/motorola-solutions-inc-stock-falls-monday-underperforms-market-24bea086-481b38fb6675?mod=mw_quote_news,msi
3,"Motorola Solutions Inc. stock rises Friday, outperforms market",2023-04-14 17:11:00,https://www.marketwatch.com/data-news/motorola-solutions-inc-stock-rises-friday-outperforms-market-bdb7f13c-46a27ea57fc1?mod=mw_quote_news,msi
4,"Motorola Solutions Inc. stock rises Thursday, still underperforms market",2023-04-13 17:10:00,https://www.marketwatch.com/data-news/motorola-solutions-inc-stock-rises-thursday-still-underperforms-market-23d3649f-0c9654abaddd?mod=mw_quote_news,msi
5,"13 Ways to Invest in India, the World’s Fastest-Growing Major Economy, According to Our Roundtable Pros.",2022-11-18 15:14:00,https://www.marketwatch.com/articles/india-fastest-growing-major-economy-invest-roundtable-51668801706?mod=mw_quote_news,msi
6,Nike and 5 More Companies That Raised Their Stock Dividends This Week,2022-11-19 07:00:00,https://www.marketwatch.com/articles/nike-keycorp-dividend-stocks-51668807347?mod=mw_quote_news,msi
7,"Dish’s 5G Network Makes the Company a Buy, Says One Analyst",2022-05-31 09:16:00,https://www.marketwatch.com/articles/dish-stock-5g-network-buy-51654002918?mod=mw_quote_news,msi
8,The Barron’s Future Focus Stock Index Is Getting Rebalanced. Here Are The Stocks Going In and Out.,2021-06-18 05:30:00,https://www.marketwatch.com/articles/the-barrons-future-focus-stock-index-is-getting-rebalanced-here-are-the-stocks-going-in-and-out-51623975923?mod=mw_quote_news,msi
9,"Charting a grinding-higher breakout, S&P 500 tags latest record peak",2021-02-09 12:32:00,https://www.marketwatch.com/story/charting-a-grinding-higher-breakout-sp-500-tags-latest-record-peak-2021-02-09-121033223?mod=mw_quote_news,msi
10,"Buy Corning, Juniper, and Casa, but Sell HP, Analyst Says",2021-01-14 13:35:00,https://www.marketwatch.com/articles/buy-corning-juniper-and-casa-but-sell-hp-analyst-says-51610649314?mod=mw_quote_news,msi
11,Nike and 6 Other Companies That Raised Their Dividend This Week,2020-11-21 08:30:00,https://www.marketwatch.com/articles/nike-and-6-other-companies-that-raised-their-dividend-this-week-51605965416?mod=mw_quote_news,msi
12,"Motorola Solutions to raise dividend by 11%, to lift the dividend yield above the S&P 500",2020-11-19 15:13:00,https://www.marketwatch.com/story/motorola-solutions-to-raise-dividend-by-11-to-lift-the-dividend-yield-above-the-sp-500-2020-11-19?mod=mw_quote_news,msi
13,Charting a bullish Q4 start:  S&P 500 extends rally from major support,2020-10-06 12:38:00,https://www.marketwatch.com/story/charting-a-bullish-q4-start-sp-500-extends-rally-from-major-support-2020-10-06-121033737?mod=mw_quote_news,msi
14,Charting a bullish Q4 start:  S&P 500 extends rally from major support,2020-10-06 12:07:00,https://www.marketwatch.com/story/charting-a-bullish-q4-start-sp-500-extends-rally-from-major-support-2020-10-06?mod=mw_quote_news,msi
